{
  "schema_version": "1.0",
  "module_id": "2025-02-28",
  "date_key_utc": "2025-02-28",
  "content_version": "v2",
  "language": "en",
  "age_band": "18-34",
  "tone": "neutral",
  "avatar_id": "ken",
  "slides": [
    {
      "slide_index": 0,
      "title": "Welcome",
      "script_text": "Welcome to our topicâ€¦",
      "captions_vtt_uri": "https://assets.ilearnhow.com/examples/2025-02-28/en/18-34/neutral/ken/0.vtt",
      "target_duration_ms": 9000,
      "sentence_boundaries_ms": [0, 4000, 9000],
      "prosody_plan_pb_uri": null,
      "viseme_timeline_pb_uri": "https://assets.ilearnhow.com/examples/2025-02-28/en/18-34/neutral/ken/0_vi.pb",
      "expression_tracks_pb_uri": "https://assets.ilearnhow.com/examples/2025-02-28/en/18-34/neutral/ken/0_ex.pb",
      "audio_manifest": {"codec":"opus","sample_rate":48000,"chunk_duration_ms":1500,"chunks":["https://assets.ilearnhow.com/examples/2025-02-28/en/18-34/neutral/ken/0_000.opus"]},
      "popup_template_id": "definition_card",
      "popup_payload": {"term":"Resilience","definition":"Ability to recover quickly","at_ms":2500},
      "asset_hashes": {"viseme":"sha256:x1"}
    }
  ],
  "integrity": {"manifest_sig": "hmac256:demo","created_at":"2025-02-10T12:00:00Z"}
}
